headline,clean,tb_polarity,tb_subjectivity,vader_compound,vader_pos,vader_neg,vader_neu,sentiment
Dow surges 600 points in relief rally after Trump says U.S. and Iran have had ‘productive’ talks: Live updates - CNBC,Dow surges 600 points in relief rally after Trump says U.S. and Iran have had ‘productive’ talks: Live updates - CNBC,0.13636363636363635,0.5,0.4767,0.134,0.0,0.866,Positive
"Stock market today: Dow, S&P 500, Nasdaq futures waver as Iran officials reject negotiation - Yahoo Finance","Stock market today: Dow, S&P 500, Nasdaq futures waver as Iran officials reject negotiation - Yahoo Finance",0.0,0.0,-0.4019,0.0,0.144,0.856,Negative
Stock futures slide after Monday’s relief rally; traders eye latest developments in Iran: Live updates - CNBC,Stock futures slide after Monday’s relief rally; traders eye latest developments in Iran: Live updates - CNBC,0.3181818181818182,0.7,0.4767,0.162,0.0,0.838,Positive
Worried about a shaky stock market? This is what financial advisers suggest you do - NPR,Worried about a shaky stock market? This is what financial advisers suggest you do - NPR,-0.16666666666666666,0.25,-0.4767,0.0,0.227,0.773,Negative
"Dow Jones Futures: Trump's Iran Comments Spark Stock Market Rally; Micron, Nvidia, Palantir, Tesla Are Big Movers - Investor's Business Daily","Dow Jones Futures: Trump's Iran Comments Spark Stock Market Rally; Micron, Nvidia, Palantir, Tesla Are Big Movers - Investor's Business Daily",0.0,0.05,0.2263,0.087,0.0,0.913,Positive
ETFs have crushed Wall Street’s go-to stock-market indicator - MarketWatch,ETFs have crushed Wall Street’s go-to stock-market indicator - MarketWatch,-0.1,0.1,-0.4215,0.0,0.237,0.763,Negative
"Stock market today (March 24, 2026): Nifty50 opens above 22,800; BSE Sensex rises over 1,100 points as US - The Times of India","Stock market today (March 24, 2026): Nifty50 opens above 22,800; BSE Sensex rises over 1,100 points as US - The Times of India",0.0,0.1,0.0,0.0,0.0,1.0,Neutral
"Stock Market Today (Mar. 23, 2026): Russell 2000 jumps 3%, escapes correction territory after Trump comments - thestreet.com","Stock Market Today (Mar. 23, 2026): Russell 2000 jumps 3%, escapes correction territory after Trump comments - thestreet.com",0.0,0.0,0.128,0.081,0.0,0.919,Positive
"US Stock Market Today: Dow Jumps Over 1,000 Points, S&P 500 and Nasdaq Surge 2% as Donald Trump Hints at Iran Deal; Gold, Silver Down, Bitcoin Near $71K | What Should Investors Watch - The Sunday Guardian","US Stock Market Today: Dow Jumps Over 1,000 Points, S&P 500 and Nasdaq Surge 2% as Donald Trump Hints at Iran Deal; Gold, Silver Down, Bitcoin Near $71K | What Should Investors Watch - The Sunday Guardian",-0.027777777777777776,0.34444444444444444,0.0,0.0,0.0,1.0,Neutral
Stock Market Today: All You Need To Know Before Going Into Trade On March 24 - NDTV Profit,Stock Market Today: All You Need To Know Before Going Into Trade On March 24 - NDTV Profit,0.0,0.0,0.4404,0.146,0.0,0.854,Positive
"Stock Market Today, March 23: Palantir Rises After the Pentagon Designates Maven Program of Record - The Motley Fool","Stock Market Today, March 23: Palantir Rises After the Pentagon Designates Maven Program of Record - The Motley Fool",0.6,0.9,-0.4404,0.0,0.139,0.861,Negative
Stocks Were Headed for a Red Monday. Then Trump Took to Social Media. - WSJ,Stocks Were Headed for a Red Monday. Then Trump Took to Social Media. - WSJ,0.016666666666666666,0.03333333333333333,0.0,0.0,0.0,1.0,Neutral
"Stock Market Today, March 23: Stocks Rally on Iran De-escalation Signals - The Motley Fool","Stock Market Today, March 23: Stocks Rally on Iran De-escalation Signals - The Motley Fool",0.6,0.9,-0.4404,0.0,0.172,0.828,Negative
Asian Stocks Set to Gain as US Eases Iran Threats: Markets Wrap - Bloomberg.com,Asian Stocks Set to Gain as US Eases Iran Threats: Markets Wrap - Bloomberg.com,0.0,0.0,0.4404,0.292,0.144,0.564,Positive
Jim Cramer says Monday’s market rally may be short-lived - CNBC,Jim Cramer says Monday’s market rally may be short-lived - CNBC,0.0,0.0,0.0,0.0,0.0,1.0,Neutral
"Stock Market Today, March 23: American Airlines Group Rallies on Easing Fuel Concerns - The Motley Fool","Stock Market Today, March 23: American Airlines Group Rallies on Easing Fuel Concerns - The Motley Fool",0.3,0.45,-0.2263,0.101,0.146,0.754,Negative
"The Stock Market's ""Fear Gauge"" Says the S&P 500 Will Make a Big Move in the Next Year (Hint: It's Good News) - The Motley Fool","The Stock Market's ""Fear Gauge"" Says the S&P 500 Will Make a Big Move in the Next Year (Hint: It's Good News) - The Motley Fool",0.32499999999999996,0.4,-0.4939,0.091,0.191,0.719,Negative
Dow Adds 631 Points as Hormuz Vise Eases: Stock Market Today - Kiplinger,Dow Adds 631 Points as Hormuz Vise Eases: Stock Market Today - Kiplinger,0.0,0.0,0.3182,0.161,0.0,0.839,Positive
"Stock Market Today, March 23: Stocks Rally on Iran De-escalation Signals - Yahoo Finance","Stock Market Today, March 23: Stocks Rally on Iran De-escalation Signals - Yahoo Finance",0.0,0.0,0.0,0.0,0.0,1.0,Neutral
"Stock Market Today, March 23: Super Micro Computer Jumps on Heavy Trading After Indictment - The Motley Fool","Stock Market Today, March 23: Super Micro Computer Jumps on Heavy Trading After Indictment - The Motley Fool",0.24444444444444444,0.6888888888888888,0.25,0.171,0.127,0.702,Positive
Asia markets tumble as Middle East conflict spiral with no sign of abating - CNBC,Asia markets tumble as Middle East conflict spiral with no sign of abating - CNBC,0.0,0.0,-0.5423,0.0,0.257,0.743,Negative
Dow Jones And U.S. Stock Market Outlook: Prudent Optimism In Wall Street As U.S.-Iran Talks Could Confirm - Seeking Alpha,Dow Jones And U.S. Stock Market Outlook: Prudent Optimism In Wall Street As U.S.-Iran Talks Could Confirm - Seeking Alpha,0.0,0.0,0.5423,0.156,0.0,0.844,Positive
"Stock Market Today, March 23: Tesla Rises on Joint Venture Plans to Build a Semiconductor Plant for AI Chip Production - The Motley Fool","Stock Market Today, March 23: Tesla Rises on Joint Venture Plans to Build a Semiconductor Plant for AI Chip Production - The Motley Fool",0.6,0.9,-0.4404,0.0,0.112,0.888,Negative
President Donald Trump Just Made a Huge Announcement About the Iran War: Here's Why it Could Be a Major Turning Point for the Stock Market - The Motley Fool,President Donald Trump Just Made a Huge Announcement About the Iran War: Here's Why it Could Be a Major Turning Point for the Stock Market - The Motley Fool,0.3541666666666667,0.7666666666666666,-0.6705,0.066,0.194,0.741,Negative
Microsoft: This Might Be the Best Core Stock Bargain in the Market Today - Morningstar,Microsoft: This Might Be the Best Core Stock Bargain in the Market Today - Morningstar,1.0,0.3,0.7184,0.316,0.0,0.684,Positive
Markets wait for Trump and Iran to follow through on Hormuz threats that carry potentially catastrophic results - Fortune,Markets wait for Trump and Iran to follow through on Hormuz threats that carry potentially catastrophic results - Fortune,0.0,1.0,-0.7184,0.0,0.261,0.739,Negative
The Stock Market Just Flashed a Warning Not Seen in 12 Months. History Says Investors Should Do This Now. - The Motley Fool,The Stock Market Just Flashed a Warning Not Seen in 12 Months. History Says Investors Should Do This Now. - The Motley Fool,0.6,0.9,-0.6486,0.0,0.202,0.798,Negative
"Dow Jones Futures Jump, Oil Prices Dive As Trump Cites 'Productive' Talks, But Iran Denies - Investor's Business Daily","Dow Jones Futures Jump, Oil Prices Dive As Trump Cites 'Productive' Talks, But Iran Denies - Investor's Business Daily",0.0,0.0,-0.5719,0.0,0.171,0.829,Negative
"Dow jumps more than 1,000 points after Trump delays ultimatum for Iran to reopen the Strait of Hormuz - CBS News","Dow jumps more than 1,000 points after Trump delays ultimatum for Iran to reopen the Strait of Hormuz - CBS News",0.5,0.5,0.0,0.0,0.0,1.0,Neutral
Stocks Bounce as Trump Backs Off Iran Infrastructure Threat - The New York Times,Stocks Bounce as Trump Backs Off Iran Infrastructure Threat - The New York Times,0.13636363636363635,0.45454545454545453,-0.5574,0.0,0.277,0.723,Negative
Why AudioEye (AEYE) Outpaced the Stock Market Today - Yahoo! Finance Canada,Why AudioEye (AEYE) Outpaced the Stock Market Today - Yahoo! Finance Canada,0.0,0.0,0.0,0.0,0.0,1.0,Neutral
Markets Are Down 5% in 2026: What Long-Term Investors Should Remember - The Motley Fool,Markets Are Down 5% in 2026: What Long-Term Investors Should Remember - The Motley Fool,0.2222222222222222,0.5944444444444444,-0.4404,0.0,0.172,0.828,Negative
"Stocks Jump, Oil Dives On Iran Hopes; Rush Street, Nextpower, Peabody Energy In Focus - Investor's Business Daily","Stocks Jump, Oil Dives On Iran Hopes; Rush Street, Nextpower, Peabody Energy In Focus - Investor's Business Daily",0.0,0.0,0.5994,0.234,0.0,0.766,Positive
"Here's When the Fed Might Cut Interest Rates Again, and What It Means for the Stock Market - The Motley Fool","Here's When the Fed Might Cut Interest Rates Again, and What It Means for the Stock Market - The Motley Fool",0.6,0.9,-0.25,0.115,0.192,0.692,Negative
"Stock Market Today, March 20: S&P 500 Drops for Third Day, Fourth Week in a Row - Yahoo Finance","Stock Market Today, March 20: S&P 500 Drops for Third Day, Fourth Week in a Row - Yahoo Finance",0.0,0.0,0.0,0.0,0.0,1.0,Neutral
Why Sony (SONY) Outpaced the Stock Market Today - Yahoo Finance,Why Sony (SONY) Outpaced the Stock Market Today - Yahoo Finance,0.0,0.0,0.0,0.0,0.0,1.0,Neutral
Stock Market Shifts Into Rally Mode As Trump Flags 'Productive' Iran Talks; AI Name Gains - Investor's Business Daily,Stock Market Shifts Into Rally Mode As Trump Flags 'Productive' Iran Talks; AI Name Gains - Investor's Business Daily,0.0,0.0,0.34,0.118,0.0,0.882,Positive
The 5 Best Stocks To Buy And Watch Right Now - Investor's Business Daily,The 5 Best Stocks To Buy And Watch Right Now - Investor's Business Daily,0.42857142857142855,0.2785714285714285,0.6369,0.244,0.0,0.756,Positive
Why Brinker International (EAT) Outpaced the Stock Market Today - Yahoo Finance,Why Brinker International (EAT) Outpaced the Stock Market Today - Yahoo Finance,0.0,0.0,0.0,0.0,0.0,1.0,Neutral
US Stock Market Today S&P 500 Futures Drop On Rising Yields And Costly Oil - Yahoo Finance,US Stock Market Today S&P 500 Futures Drop On Rising Yields And Costly Oil - Yahoo Finance,0.0,0.0,-0.3612,0.0,0.189,0.811,Negative
"Stock market today: Dow surges on Trump's Iran comments; Nvidia, Tesla rebound (live coverage) - MSN","Stock market today: Dow surges on Trump's Iran comments; Nvidia, Tesla rebound (live coverage) - MSN",0.13636363636363635,0.5,0.0,0.0,0.0,1.0,Neutral
"Why Are Stock Market Futures Down Today, 3/24/26? - TipRanks","Why Are Stock Market Futures Down Today, 3/24/26? - TipRanks",-0.15555555555555556,0.2888888888888889,0.0,0.0,0.0,1.0,Neutral
"Stock Market Today, March 20: Planet Labs Surges After Record Revenue and Upbeat Guidance - Yahoo Finance","Stock Market Today, March 20: Planet Labs Surges After Record Revenue and Upbeat Guidance - Yahoo Finance",0.0,0.0,0.0,0.0,0.0,1.0,Neutral
Stock Market Today (LIVE): Palantir Rises as Markets Turn Risk-On; Oil Drop Masks Supply Crunch? - The Motley Fool,Stock Market Today (LIVE): Palantir Rises as Markets Turn Risk-On; Oil Drop Masks Supply Crunch? - The Motley Fool,0.36818181818181817,0.7,-0.6124,0.0,0.227,0.773,Negative
Morning News Wrap-Up 3/23/26: Today’s Biggest Stock Market Stories! - TipRanks,Morning News Wrap-Up 3/23/26: Today’s Biggest Stock Market Stories! - TipRanks,0.0,0.0,0.0,0.0,0.0,1.0,Neutral
"Stock Market Today, March 9: Markets Rally Back After President Trump Suggests Iran War Could Be Close to Ending - Yahoo Finance","Stock Market Today, March 9: Markets Rally Back After President Trump Suggests Iran War Could Be Close to Ending - Yahoo Finance",0.0,0.0,-0.5994,0.0,0.157,0.843,Negative
Stock markets in meltdown after Trump threatens major escalation in the war against Iran - Fortune,Stock markets in meltdown after Trump threatens major escalation in the war against Iran - Fortune,0.0625,0.5,-0.7579,0.0,0.317,0.683,Negative
What might Warren Buffett think about today’s stock market? - Yahoo Finance UK,What might Warren Buffett think about today’s stock market? - Yahoo Finance UK,0.0,0.0,0.0,0.0,0.0,1.0,Neutral
US Stock Market Today S&P 500 Futures Edge Higher As Traders Watch Jobs Data - Yahoo Finance,US Stock Market Today S&P 500 Futures Edge Higher As Traders Watch Jobs Data - Yahoo Finance,0.25,0.5,0.0,0.0,0.0,1.0,Neutral
"Stock Market Today, March 19: AT&T Rises After Launch of AI-Powered Customer App - Yahoo Finance","Stock Market Today, March 19: AT&T Rises After Launch of AI-Powered Customer App - Yahoo Finance",0.0,0.0,0.0,0.0,0.0,1.0,Neutral
Dow Logs Worst Weekly Losing Streak Since 2023: Stock Market Today - Kiplinger,Dow Logs Worst Weekly Losing Streak Since 2023: Stock Market Today - Kiplinger,-1.0,1.0,-0.7717,0.0,0.379,0.621,Negative
Stock market today: Dow futures fall 300 points as Trump hints at Iran sanctions relief - Fortune,Stock market today: Dow futures fall 300 points as Trump hints at Iran sanctions relief - Fortune,0.0,0.0,0.4767,0.162,0.0,0.838,Positive
US Stock Market Today: S&P 500 Futures Fall As Global Bond Yields And Tensions Rise - simplywall.st,US Stock Market Today: S&P 500 Futures Fall As Global Bond Yields And Tensions Rise - simplywall.st,0.0,0.0,-0.4019,0.0,0.144,0.856,Negative
Stock market jumps as Trump says deal with Iran could be soon - Seeking Alpha,Stock market jumps as Trump says deal with Iran could be soon - Seeking Alpha,0.0,0.0,0.0,0.0,0.0,1.0,Neutral
"Why Is the Stock Market Up Today, 3/23/26? - TipRanks","Why Is the Stock Market Up Today, 3/23/26? - TipRanks",0.0,0.0,0.0,0.0,0.0,1.0,Neutral
Stock Market Crash: The Best Cryptocurrencies to Buy Right Now - The Motley Fool,Stock Market Crash: The Best Cryptocurrencies to Buy Right Now - The Motley Fool,0.6285714285714286,0.5785714285714286,-0.1027,0.202,0.269,0.529,Negative
US stock market today: Wall Street jumps as Donald Trump delays Iran strikes; oil prices retreat - The Times of India,US stock market today: Wall Street jumps as Donald Trump delays Iran strikes; oil prices retreat - The Times of India,0.0,0.0,-0.1779,0.077,0.107,0.815,Negative
"Stock Market Review Today: SPY, QQQ Rebound as Trump Teases U.S.-Iran Deal; Oil Plummets 10% - TipRanks","Stock Market Review Today: SPY, QQQ Rebound as Trump Teases U.S.-Iran Deal; Oil Plummets 10% - TipRanks",0.0,0.0,-0.296,0.0,0.121,0.879,Negative
"Top stocks to sell today: Stock market recommendations for March 24, 2026 - check list - The Times of India","Top stocks to sell today: Stock market recommendations for March 24, 2026 - check list - The Times of India",0.5,0.5,0.2023,0.087,0.0,0.913,Positive
"Stock Market Today: S&P 500, Dow Jones Futures Plunge As Trump Issues Ultimatum To 'Obliterate' Iran—SSR Mining, Nebius, United Airlines In Focus - Benzinga","Stock Market Today: S&P 500, Dow Jones Futures Plunge As Trump Issues Ultimatum To 'Obliterate' Iran—SSR Mining, Nebius, United Airlines In Focus - Benzinga",0.0,0.0,-0.2732,0.098,0.136,0.767,Negative
"Stock Market Today, March 4: Plug Power Continues to Surge With Another 11% Gain - The Motley Fool","Stock Market Today, March 4: Plug Power Continues to Surge With Another 11% Gain - The Motley Fool",0.6,0.9,0.128,0.152,0.13,0.717,Positive
"Why Is Vanguard Total Stock Market ETF (VTI) Rising Today, 03/23/26? - TipRanks","Why Is Vanguard Total Stock Market ETF (VTI) Rising Today, 03/23/26? - TipRanks",0.0,0.75,0.0,0.0,0.0,1.0,Neutral
"Why Are Stock Market Futures Surging Today, 3/23/26? - TipRanks","Why Are Stock Market Futures Surging Today, 3/23/26? - TipRanks",0.0,0.0,0.0,0.0,0.0,1.0,Neutral
"Stock market today: Gift Nifty jumps; US-Iran war, India VIX to oil, gold, silver rates — six stocks to buy or sell - Mint","Stock market today: Gift Nifty jumps; US-Iran war, India VIX to oil, gold, silver rates — six stocks to buy or sell - Mint",0.0,0.0,0.1779,0.184,0.128,0.689,Positive
"Korean Stocks to Bounce, US Inflation Fears Ease: Markets Wrap - Bloomberg.com","Korean Stocks to Bounce, US Inflation Fears Ease: Markets Wrap - Bloomberg.com",0.0,0.0,-0.0772,0.163,0.183,0.654,Negative
"Stock Market Today, March 17: Markets Edge Upwards as Fed Meeting Opens - Yahoo Finance","Stock Market Today, March 17: Markets Edge Upwards as Fed Meeting Opens - Yahoo Finance",0.0,0.0,0.0,0.0,0.0,1.0,Neutral
"Stock Market Today, Feb. 27: Inflation and AI Fears Lead to February Slump - Yahoo Finance","Stock Market Today, Feb. 27: Inflation and AI Fears Lead to February Slump - Yahoo Finance",0.0,0.0,-0.4215,0.0,0.157,0.843,Negative
"PATH $12.13 pre-market 24 Mar 2026 (UiPath, NYSE): AI stock outlook - Meyka","PATH $12.13 pre-market 24 Mar 2026 (UiPath, NYSE): AI stock outlook - Meyka",0.0,0.0,0.0,0.0,0.0,1.0,Neutral
U.S. Stock Market Week Ahead: Iran Oil Shock Tests S&P 500 After Six-Month Low - TechStock²,U.S. Stock Market Week Ahead: Iran Oil Shock Tests S&P 500 After Six-Month Low - TechStock²,0.0,0.3,-0.5719,0.0,0.251,0.749,Negative
"Stock Market News Today, 3/23/26 – Stock Futures Jump as Trump Says U.S.-Iran Held ‘Productive Talks’ - TipRanks","Stock Market News Today, 3/23/26 – Stock Futures Jump as Trump Says U.S.-Iran Held ‘Productive Talks’ - TipRanks",0.0,0.0,0.0,0.0,0.0,1.0,Neutral
US Stock Market Today: S&P 500 Futures Dip As Rate Sensitivity Tempers Optimism - Yahoo Finance,US Stock Market Today: S&P 500 Futures Dip As Rate Sensitivity Tempers Optimism - Yahoo Finance,0.0,0.0,0.296,0.177,0.116,0.707,Positive
"US Stock Market Today: Dow, S&P 500, Nasdaq Surge as Oil Tumbles on Iran Reprieve - TechStock²","US Stock Market Today: Dow, S&P 500, Nasdaq Surge as Oil Tumbles on Iran Reprieve - TechStock²",0.0,0.0,0.0,0.0,0.0,1.0,Neutral
"Dow Jones Futures Fall, Oil Prices Rise Again; AI Chip Giant Broadcom Jumps - Investor's Business Daily","Dow Jones Futures Fall, Oil Prices Rise Again; AI Chip Giant Broadcom Jumps - Investor's Business Daily",0.0,0.5,0.0,0.0,0.0,1.0,Neutral
Why Did FFAI Stock Soar 50% In Pre-Market Today? - Stocktwits,Why Did FFAI Stock Soar 50% In Pre-Market Today? - Stocktwits,0.0,0.0,0.0,0.0,0.0,1.0,Neutral
"WJ9.SI stock up 33.33% pre-market on high volume (SES, 24 Mar 2026): watch liquidity - Meyka","WJ9.SI stock up 33.33% pre-market on high volume (SES, 24 Mar 2026): watch liquidity - Meyka",0.16,0.54,0.0,0.0,0.0,1.0,Neutral
"Stock Market Today: Futures Slide as Iran War Sends Oil Past $99, Four-Week Losing Streak Deepens - techi.com","Stock Market Today: Futures Slide as Iran War Sends Oil Past $99, Four-Week Losing Streak Deepens - techi.com",-0.25,0.25,-0.7579,0.0,0.289,0.711,Negative
"Sensex rallies 1,500 points: Why is the stock market rising today? - India Today","Sensex rallies 1,500 points: Why is the stock market rising today? - India Today",0.0,0.0,0.0,0.0,0.0,1.0,Neutral
Why the US Stock Market Decline is Starting to Look Bad - EBC Financial Group,Why the US Stock Market Decline is Starting to Look Bad - EBC Financial Group,-0.23333333333333328,0.25555555555555554,-0.5423,0.0,0.2,0.8,Negative
CHF74.85: NESN.SW Nestlé S.A. (SIX) pre-market 24 Mar 2026 most active: outlook - Meyka,CHF74.85: NESN.SW Nestlé S.A. (SIX) pre-market 24 Mar 2026 most active: outlook - Meyka,0.18333333333333335,0.55,0.4576,0.187,0.0,0.813,Positive
Volume spike: 4COP.F Global X Copper Miners (XETRA) pre-market 24 Mar 2026 watch - Meyka,Volume spike: 4COP.F Global X Copper Miners (XETRA) pre-market 24 Mar 2026 watch - Meyka,0.0,0.0,0.0,0.0,0.0,1.0,Neutral
"Nifty 50, Sensex today: What to expect from Indian stock market in trade on March 24 amid signs of cooling US-Iran war - Mint","Nifty 50, Sensex today: What to expect from Indian stock market in trade on March 24 amid signs of cooling US-Iran war - Mint",0.0,0.0,-0.296,0.094,0.136,0.769,Negative
Stock markets and oil prices still volatile over fears Iran war may drag on - BBC,Stock markets and oil prices still volatile over fears Iran war may drag on - BBC,-0.1,0.07083333333333333,-0.8225,0.0,0.398,0.602,Negative
Why Blue Owl Capital stock is gaining today? - Invezz,Why Blue Owl Capital stock is gaining today? - Invezz,0.0,0.1,0.4215,0.237,0.0,0.763,Positive
Blue Cloud Softech Solutions Share Price Jumps Over 6% Amid Broad Market Rally | Stock Market Today - Samco,Blue Cloud Softech Solutions Share Price Jumps Over 6% Amid Broad Market Rally | Stock Market Today - Samco,0.03125,0.20625,0.4404,0.187,0.0,0.813,Positive
"Stock Market Today, Feb. 26: Nasdaq and S&P 500 Stumble on Fading Nvidia Optimism - The Motley Fool","Stock Market Today, Feb. 26: Nasdaq and S&P 500 Stumble on Fading Nvidia Optimism - The Motley Fool",0.27499999999999997,0.5,0.1531,0.156,0.129,0.714,Positive
SEPC Share Price Jumps Over 7% on Acquisition Update — Penny Stock Under ₹5 Reacts to Mining MoU | Stock Market Today - Samco,SEPC Share Price Jumps Over 7% on Acquisition Update — Penny Stock Under ₹5 Reacts to Mining MoU | Stock Market Today - Samco,0.0,0.0,0.296,0.087,0.0,0.913,Positive
NMR Stock Today: Nomura’s Guinness Record Caps 100th Year – March 24 - Meyka,NMR Stock Today: Nomura’s Guinness Record Caps 100th Year – March 24 - Meyka,0.0,0.0,0.0,0.0,0.0,1.0,Neutral
US Stock Market Today: S&P 500 Futures Rise As Inflation Worries Ease - Yahoo Finance,US Stock Market Today: S&P 500 Futures Rise As Inflation Worries Ease - Yahoo Finance,0.0,0.0,-0.0772,0.137,0.153,0.71,Negative
4 Key Stock Market Trends to Watch This Week - National Today,4 Key Stock Market Trends to Watch This Week - National Today,0.0,1.0,0.0,0.0,0.0,1.0,Neutral
"Stock Market Today: Strong rebound on D-Street; Sensex jumps to 73,650; Nifty nears 22,800 - Zee Business","Stock Market Today: Strong rebound on D-Street; Sensex jumps to 73,650; Nifty nears 22,800 - Zee Business",0.43333333333333335,0.7333333333333334,0.7184,0.286,0.0,0.714,Positive
"Stock Market Today, Jan. 30: Gold Plunges As Dollar Strengthens - Yahoo Finance","Stock Market Today, Jan. 30: Gold Plunges As Dollar Strengthens - Yahoo Finance",0.0,0.0,0.4588,0.2,0.0,0.8,Positive
GSP Crop Science Share Price Makes Subdued Listing Debut at 4% Premium Over IPO Price | Stock Market Today - Samco,GSP Crop Science Share Price Makes Subdued Listing Debut at 4% Premium Over IPO Price | Stock Market Today - Samco,0.0,0.0,0.296,0.099,0.0,0.901,Positive
US Stock Market Today: S&P 500 Futures Edge Higher On Strong Hiring And Rate Hopes - simplywall.st,US Stock Market Today: S&P 500 Futures Edge Higher On Strong Hiring And Rate Hopes - simplywall.st,0.3416666666666667,0.6166666666666667,0.7269,0.289,0.0,0.711,Positive
"Dow Jones Futures Fall, Bitcoin Dives To Lowest Since 2024; Google, AMD, Amazon, Palantir Due - Investor's Business Daily","Dow Jones Futures Fall, Bitcoin Dives To Lowest Since 2024; Google, AMD, Amazon, Palantir Due - Investor's Business Daily",-0.0625,0.1875,-0.2263,0.08,0.122,0.798,Negative
US Stock Market Today: S&P 500 Futures Fall As Rising Yields Pressure Tech - Yahoo Finance,US Stock Market Today: S&P 500 Futures Fall As Rising Yields Pressure Tech - Yahoo Finance,0.0,0.0,-0.296,0.0,0.128,0.872,Negative
"Stock Market Today: Sensex Surges 1,000 Points, Nifty Above 22,800, ITC, Banking, and Auto Stocks in Focus - Analytics Insight","Stock Market Today: Sensex Surges 1,000 Points, Nifty Above 22,800, ITC, Banking, and Auto Stocks in Focus - Analytics Insight",0.0,0.1,0.4019,0.124,0.0,0.876,Positive
"NIFTY50, SENSEX today: Wall Street cues, FII activity, key things to know before markets open on March 24 - Upstox","NIFTY50, SENSEX today: Wall Street cues, FII activity, key things to know before markets open on March 24 - Upstox",0.0,0.75,0.0,0.0,0.0,1.0,Neutral
Will 2026 Be a High-Wire Act for Markets? - Morgan Stanley,Will 2026 Be a High-Wire Act for Markets? - Morgan Stanley,0.0,0.0,0.0,0.0,0.0,1.0,Neutral
"Stock Market Today, Jan. 21: Dow Rebounds After Greenland and Tariff Tensions Ease - Yahoo Finance","Stock Market Today, Jan. 21: Dow Rebounds After Greenland and Tariff Tensions Ease - Yahoo Finance",0.0,0.0,-0.0516,0.13,0.141,0.729,Negative
Ceigall India Secures Highway Project from NHAI | Kotak Mahindra Sells Stake in Infina | Top Buzzing Stocks Today - Equitymaster,Ceigall India Secures Highway Project from NHAI | Kotak Mahindra Sells Stake in Infina | Top Buzzing Stocks Today - Equitymaster,0.5,0.5,0.4767,0.177,0.0,0.823,Positive
"Inside the Turmoil at RFK Jr.’s CDC, as Told by Current and Former Employees - The New York Times","Inside the Turmoil at RFK Jr.’s CDC, as Told by Current and Former Employees - The New York Times",0.04545454545454545,0.28484848484848485,-0.3612,0.0,0.122,0.878,Negative
"Empty offices, vacant storefronts raise stakes in D.C. mayoral election - The Washington Post","Empty offices, vacant storefronts raise stakes in D.C. mayoral election - The Washington Post",-0.1,0.5,-0.2023,0.0,0.122,0.878,Negative
"Janice S. Flynn Obituary March 22, 2026 - Meng Family Funeral Homes - Meng Family Funeral Homes","Janice S. Flynn Obituary March 22, 2026 - Meng Family Funeral Homes - Meng Family Funeral Homes",0.0,0.0,-0.6124,0.0,0.25,0.75,Negative
"John S. Polasek Obituary March 23, 2026 - amsfuneralhomes.com","John S. Polasek Obituary March 23, 2026 - amsfuneralhomes.com",0.0,0.0,0.0,0.0,0.0,1.0,Neutral
All lanes of northbound I-5 reopen at S 188th Street in SeaTac after crash is cleared - KING5.com,All lanes of northbound I-5 reopen at S 188th Street in SeaTac after crash is cleared - KING5.com,0.0,0.0,-0.3182,0.07,0.134,0.796,Negative
"Ja'Kobi Gillespie, Tennessee end Miami (Ohio)'s captivating season - ESPN","Ja'Kobi Gillespie, Tennessee end Miami (Ohio)'s captivating season - ESPN",0.5,1.0,0.0,0.0,0.0,1.0,Neutral
2026 Mercedes-Maybach S-Class facelift teased ahead of reveal - The Supercar Blog,2026 Mercedes-Maybach S-Class facelift teased ahead of reveal - The Supercar Blog,0.0,0.0,-0.296,0.0,0.167,0.833,Negative
