headline,clean,tb_polarity,tb_subjectivity,vader_compound,vader_pos,vader_neg,vader_neu,sentiment
"Emkay Global initiates coverage on Kalpataru with 'Buy', sees 48% upside - Business Standard","Emkay Global initiates coverage on Kalpataru with 'Buy', sees 48% upside - Business Standard",0.0,0.0,0.0,0.0,0.0,1.0,Neutral
"Markets Rally, But CG-VAK Software & Exports Ltd Sinks to 52-Week Low in Stock-Specific Sell-Off - Markets Mojo","Markets Rally, But CG-VAK Software & Exports Ltd Sinks to 52-Week Low in Stock-Specific Sell-Off - Markets Mojo",-0.05,0.15,-0.3919,0.0,0.135,0.865,Negative
Markets Rally on Trump-Iran Talks Relief - Business Standard,Markets Rally on Trump-Iran Talks Relief - Business Standard,0.0,0.0,0.4767,0.279,0.0,0.721,Positive
Dow Jones Futures Fall After Trump Hikes Global Tariff; Novo Dives On Obesity Drug News - Investor's Business Daily,Dow Jones Futures Fall After Trump Hikes Global Tariff; Novo Dives On Obesity Drug News - Investor's Business Daily,0.0,0.0,0.0,0.0,0.0,1.0,Neutral
"Markets Rally, But Suratwwala Business Group Ltd Sinks to 52-Week Low in Stock-Specific Sell-Off - Markets Mojo","Markets Rally, But Suratwwala Business Group Ltd Sinks to 52-Week Low in Stock-Specific Sell-Off - Markets Mojo",-0.05,0.15,-0.3919,0.0,0.142,0.858,Negative
"Stock market rally: Sensex surges 1,172 pts, Nifty reclaims 22,850; Asian Paints, Titan lead gainers - Business Today","Stock market rally: Sensex surges 1,172 pts, Nifty reclaims 22,850; Asian Paints, Titan lead gainers - Business Today",0.0,0.0,0.4019,0.137,0.0,0.863,Positive
"Markets Rally, But Supriya Lifescience Ltd Sinks to 52-Week Low in Stock-Specific Sell-Off - Markets Mojo","Markets Rally, But Supriya Lifescience Ltd Sinks to 52-Week Low in Stock-Specific Sell-Off - Markets Mojo",-0.05,0.15,-0.3919,0.0,0.15,0.85,Negative
"Markets Rally, But NIIT Learning Systems Ltd Sinks to 52-Week Low in Stock-Specific Sell-Off - Markets Mojo","Markets Rally, But NIIT Learning Systems Ltd Sinks to 52-Week Low in Stock-Specific Sell-Off - Markets Mojo",-0.05,0.15,-0.3919,0.0,0.142,0.858,Negative
The Stock-Market Rally Isn’t Just About Tech Anymore - WSJ,The Stock-Market Rally Isn’t Just About Tech Anymore - WSJ,0.0,0.0,0.0,0.0,0.0,1.0,Neutral
"Asian markets today: Nikkei, Kospi rally up to 3% on signs of de-escalation in US-Iran war - Mint","Asian markets today: Nikkei, Kospi rally up to 3% on signs of de-escalation in US-Iran war - Mint",0.0,0.0,-0.5994,0.0,0.187,0.813,Negative
"Markets Rally, But Patel Retail Ltd Sinks to 52-Week Low in Stock-Specific Sell-Off - Markets Mojo","Markets Rally, But Patel Retail Ltd Sinks to 52-Week Low in Stock-Specific Sell-Off - Markets Mojo",-0.05,0.15,-0.3919,0.0,0.15,0.85,Negative
Not 'very hawkish at all': Wall Street optimistic on stock market rally in 2026 after Fed rate cut - Yahoo Finance,Not 'very hawkish at all': Wall Street optimistic on stock market rally in 2026 after Fed rate cut - Yahoo Finance,-0.1,0.3,0.0516,0.098,0.09,0.812,Positive
"Stocks rise, supported by tech rally as Nvidia reports strong results - Reuters","Stocks rise, supported by tech rally as Nvidia reports strong results - Reuters",0.43333333333333335,0.7333333333333334,0.6808,0.337,0.0,0.663,Positive
"Markets Rally, But Andhra Cements Ltd Sinks to 52-Week Low in Stock-Specific Sell-Off - Markets Mojo","Markets Rally, But Andhra Cements Ltd Sinks to 52-Week Low in Stock-Specific Sell-Off - Markets Mojo",-0.05,0.15,-0.3919,0.0,0.15,0.85,Negative
"Sensex jumps 1,500 points, investors earn ₹5 lakh crore: Short covering, US-Iran, other key factors behind market rally - MSN","Sensex jumps 1,500 points, investors earn ₹5 lakh crore: Short covering, US-Iran, other key factors behind market rally - MSN",-0.13125,0.59375,0.0,0.0,0.0,1.0,Neutral
"Markets Rally, But Restaurant Brands Asia Ltd Sinks to 52-Week Low in Stock-Specific Sell-Off - Markets Mojo","Markets Rally, But Restaurant Brands Asia Ltd Sinks to 52-Week Low in Stock-Specific Sell-Off - Markets Mojo",-0.05,0.15,-0.3919,0.0,0.142,0.858,Negative
Markets Rally as Trump Temporarily Simmers Iran Tensions - Devdiscourse,Markets Rally as Trump Temporarily Simmers Iran Tensions - Devdiscourse,0.0,0.0,-0.4019,0.0,0.231,0.769,Negative
Why good financial news didn't fuel a broad stock market rally - Detroit Free Press,Why good financial news didn't fuel a broad stock market rally - Detroit Free Press,0.290625,0.42812500000000003,0.7351,0.323,0.0,0.677,Positive
"From Gift Nifty, Wall Street rally to Crude oil price: 8 key things that changed for Indian stock market overnight - Mint","From Gift Nifty, Wall Street rally to Crude oil price: 8 key things that changed for Indian stock market overnight - Mint",-0.35,1.0,0.2263,0.198,0.131,0.671,Positive
"Markets Rally, But GHCL Ltd Sinks to 52-Week Low in Stock-Specific Sell-Off - Markets Mojo","Markets Rally, But GHCL Ltd Sinks to 52-Week Low in Stock-Specific Sell-Off - Markets Mojo",-0.05,0.15,-0.3919,0.0,0.159,0.841,Negative
"Markets Rally, But Cyient DLM Ltd Sinks to 52-Week Low in Stock-Specific Sell-Off - Markets Mojo","Markets Rally, But Cyient DLM Ltd Sinks to 52-Week Low in Stock-Specific Sell-Off - Markets Mojo",-0.05,0.15,-0.3919,0.0,0.15,0.85,Negative
"Markets Rally, But Hindustan Composites Ltd Sinks to 52-Week Low in Stock-Specific Sell-Off - Markets Mojo","Markets Rally, But Hindustan Composites Ltd Sinks to 52-Week Low in Stock-Specific Sell-Off - Markets Mojo",-0.05,0.15,-0.3919,0.0,0.15,0.85,Negative
"US stock market on the move today: Dow, S&P 500, Nasdaq all pumped up - Oracle, Nvidia, Tesla and other AI - The Economic Times","US stock market on the move today: Dow, S&P 500, Nasdaq all pumped up - Oracle, Nvidia, Tesla and other AI - The Economic Times",0.037500000000000006,0.2875,0.0,0.0,0.0,1.0,Neutral
Jim Cramer unpacks the different aspects of Wednesday's market rally - CNBC,Jim Cramer unpacks the different aspects of Wednesday's market rally - CNBC,0.0,0.6,0.0,0.0,0.0,1.0,Neutral
"Markets Rally, But Digicontent Ltd Sinks to 52-Week Low in Stock-Specific Sell-Off - Markets Mojo","Markets Rally, But Digicontent Ltd Sinks to 52-Week Low in Stock-Specific Sell-Off - Markets Mojo",-0.05,0.15,-0.3919,0.0,0.159,0.841,Negative
Friday’s stock-market rally reveals what investors are really focused on in 2026 - MarketWatch,Friday’s stock-market rally reveals what investors are really focused on in 2026 - MarketWatch,0.2,0.2,0.4391,0.182,0.0,0.818,Positive
"Markets Rally, But Astal Laboratories Ltd Sinks to 52-Week Low in Stock-Specific Sell-Off - Markets Mojo","Markets Rally, But Astal Laboratories Ltd Sinks to 52-Week Low in Stock-Specific Sell-Off - Markets Mojo",-0.05,0.15,-0.3919,0.0,0.15,0.85,Negative
"Markets Rally, But FDC Ltd Sinks to 52-Week Low in Stock-Specific Sell-Off - Markets Mojo","Markets Rally, But FDC Ltd Sinks to 52-Week Low in Stock-Specific Sell-Off - Markets Mojo",-0.05,0.15,-0.3919,0.0,0.159,0.841,Negative
Why the stock market could easily get spooked - Yahoo Finance,Why the stock market could easily get spooked - Yahoo Finance,0.43333333333333335,0.8333333333333334,0.34,0.194,0.0,0.806,Positive
"Markets Rally, But R K Swamy Ltd Sinks to 52-Week Low in Stock-Specific Sell-Off - Markets Mojo","Markets Rally, But R K Swamy Ltd Sinks to 52-Week Low in Stock-Specific Sell-Off - Markets Mojo",-0.05,0.15,-0.3919,0.0,0.142,0.858,Negative
"Markets Rally, But Hiliks Technologies Ltd Sinks to 52-Week Low in Stock-Specific Sell-Off - Markets Mojo","Markets Rally, But Hiliks Technologies Ltd Sinks to 52-Week Low in Stock-Specific Sell-Off - Markets Mojo",-0.05,0.15,-0.3919,0.0,0.15,0.85,Negative
Sensex Surges Over 2% as All Sectors Advance; Large Caps Lead Market Rally - Markets Mojo,Sensex Surges Over 2% as All Sectors Advance; Large Caps Lead Market Rally - Markets Mojo,0.21428571428571427,0.42857142857142855,0.0,0.0,0.0,1.0,Neutral
"Sensex jumps over 800 points, Nifty above 22700; Oil prices rebound after 11% fall, 5 factors behind market rally - DNA India","Sensex jumps over 800 points, Nifty above 22700; Oil prices rebound after 11% fall, 5 factors behind market rally - DNA India",-0.2,0.39999999999999997,0.4019,0.114,0.0,0.886,Positive
"Markets Rally, But Indraprastha Gas Ltd Sinks to 52-Week Low in Stock-Specific Sell-Off - Markets Mojo","Markets Rally, But Indraprastha Gas Ltd Sinks to 52-Week Low in Stock-Specific Sell-Off - Markets Mojo",-0.05,0.15,-0.3919,0.0,0.15,0.85,Negative
"Markets Rally, But Enkei Wheels India Ltd Sinks to 52-Week Low in Stock-Specific Sell-Off - Markets Mojo","Markets Rally, But Enkei Wheels India Ltd Sinks to 52-Week Low in Stock-Specific Sell-Off - Markets Mojo",-0.05,0.15,-0.3919,0.0,0.142,0.858,Negative
"Markets Rally, But Diamines & Chemicals Ltd Sinks to 52-Week Low in Stock-Specific Sell-Off - Markets Mojo","Markets Rally, But Diamines & Chemicals Ltd Sinks to 52-Week Low in Stock-Specific Sell-Off - Markets Mojo",-0.05,0.15,-0.3919,0.0,0.142,0.858,Negative
"Markets Rally, But Indoco Remedies Ltd Sinks to 52-Week Low in Stock-Specific Sell-Off - Markets Mojo","Markets Rally, But Indoco Remedies Ltd Sinks to 52-Week Low in Stock-Specific Sell-Off - Markets Mojo",-0.05,0.15,-0.3919,0.0,0.15,0.85,Negative
"Markets Rally, But ITC Ltd. Sinks to 52-Week Low in Stock-Specific Sell-Off - Markets Mojo","Markets Rally, But ITC Ltd. Sinks to 52-Week Low in Stock-Specific Sell-Off - Markets Mojo",-0.05,0.15,-0.3919,0.0,0.159,0.841,Negative
"Bulls fight back: Sensex surges 1,600 pts, Nifty reclaims 23k: US-Iran ceasefire report among key factors... - Moneycontrol.com","Bulls fight back: Sensex surges 1,600 pts, Nifty reclaims 23k: US-Iran ceasefire report among key factors... - Moneycontrol.com",0.0,0.5,0.0258,0.127,0.122,0.751,Neutral
"Stocks making biggest moves midday: Tata Power, HDFC Bank, Suzlon Energy, IRFC and more - The Financial Express","Stocks making biggest moves midday: Tata Power, HDFC Bank, Suzlon Energy, IRFC and more - The Financial Express",0.25,0.25,0.2732,0.11,0.0,0.89,Positive
Why Bitcoin Holds the Key to a December Stock Market Rally - Barron's,Why Bitcoin Holds the Key to a December Stock Market Rally - Barron's,0.0,1.0,0.0,0.0,0.0,1.0,Neutral
"Markets Rally, But Fedders Holding Ltd Sinks to 52-Week Low in Stock-Specific Sell-Off - Markets Mojo","Markets Rally, But Fedders Holding Ltd Sinks to 52-Week Low in Stock-Specific Sell-Off - Markets Mojo",-0.05,0.15,-0.3919,0.0,0.15,0.85,Negative
China Steps In to Cool Stock Market Rally Amid Global Boom - Bloomberg.com,China Steps In to Cool Stock Market Rally Amid Global Boom - Bloomberg.com,0.175,0.325,0.3182,0.161,0.0,0.839,Positive
"Markets Rally, But Uflex Ltd Sinks to 52-Week Low in Stock-Specific Sell-Off - Markets Mojo","Markets Rally, But Uflex Ltd Sinks to 52-Week Low in Stock-Specific Sell-Off - Markets Mojo",-0.05,0.15,-0.3919,0.0,0.159,0.841,Negative
"Tech Giants Lead Stock Market Rally: Nvidia, CoreWeave, and AMD in Focus - Yahoo Finance","Tech Giants Lead Stock Market Rally: Nvidia, CoreWeave, and AMD in Focus - Yahoo Finance",0.0,0.0,0.0,0.0,0.0,1.0,Neutral
"Markets Rally, But Gini Silk Mills Ltd Sinks to 52-Week Low in Stock-Specific Sell-Off - Markets Mojo","Markets Rally, But Gini Silk Mills Ltd Sinks to 52-Week Low in Stock-Specific Sell-Off - Markets Mojo",-0.05,0.15,-0.3919,0.0,0.142,0.858,Negative
Wall Street indexes rally after Trump postpones strikes on Iran's power plants - Reuters,Wall Street indexes rally after Trump postpones strikes on Iran's power plants - Reuters,0.0,0.0,-0.5574,0.0,0.277,0.723,Negative
Iran War Live Updates: Israel Says Iran Has Launched Fresh Waves of Missiles - WSJ,Iran War Live Updates: Israel Says Iran Has Launched Fresh Waves of Missiles - WSJ,0.21818181818181817,0.5,-0.2732,0.193,0.198,0.609,Negative
Why Wall Street seems to keep believing Trump - CNN,Why Wall Street seems to keep believing Trump - CNN,0.0,0.0,0.0,0.0,0.0,1.0,Neutral
Wall Street and FTSE bounce back as Trump says US and Iran close to ‘total resolution of war’ - Yahoo Finance UK,Wall Street and FTSE bounce back as Trump says US and Iran close to ‘total resolution of war’ - Yahoo Finance UK,0.0,0.375,0.0,0.0,0.0,1.0,Neutral
What Wall Street pros are saying after Trump postponed strikes on Iranian power plants - Business Insider,What Wall Street pros are saying after Trump postponed strikes on Iranian power plants - Business Insider,0.0,0.0,-0.5106,0.0,0.223,0.777,Negative
Wall Street Week Ahead - Seeking Alpha,Wall Street Week Ahead - Seeking Alpha,0.0,0.0,0.0,0.0,0.0,1.0,Neutral
Vertiv Is Up 64% in 2026 and Wall Street Says It's Still a Buy. Is This the Best Artificial Intelligence (AI) Infrastructure Stock? - The Motley Fool,Vertiv Is Up 64% in 2026 and Wall Street Says It's Still a Buy. Is This the Best Artificial Intelligence (AI) Infrastructure Stock? - The Motley Fool,0.3333333333333333,0.7333333333333334,0.6597,0.213,0.085,0.702,Positive
Nasdaq seeks to build crypto into Wall Street’s market plumbing - The Detroit News,Nasdaq seeks to build crypto into Wall Street’s market plumbing - The Detroit News,0.0,0.0,0.0,0.0,0.0,1.0,Neutral
Gulf States Edge Toward Joining Fight Against Iran - WSJ,Gulf States Edge Toward Joining Fight Against Iran - WSJ,0.0,0.0,-0.3818,0.0,0.224,0.776,Negative
Tracking The Sector Outperformers Of The Iran War - Seeking Alpha,Tracking The Sector Outperformers Of The Iran War - Seeking Alpha,0.0,0.0,-0.5994,0.0,0.281,0.719,Negative
3 themes that gripped Wall Street as stocks dropped for a 4th straight week - CNBC,3 themes that gripped Wall Street as stocks dropped for a 4th straight week - CNBC,0.2,0.4,0.2263,0.112,0.0,0.888,Positive
Asian Markets Track Wall Street Higher - RTTNews,Asian Markets Track Wall Street Higher - RTTNews,0.125,0.25,0.0,0.0,0.0,1.0,Neutral
1 Stock-Split Stock to Buy Before It Soars 63% According to a Wall Street Analyst - The Motley Fool,1 Stock-Split Stock to Buy Before It Soars 63% According to a Wall Street Analyst - The Motley Fool,0.6,0.9,-0.4404,0.0,0.139,0.861,Negative
Wall Street Holds Firm as War Shakes Global Markets - Modern Diplomacy,Wall Street Holds Firm as War Shakes Global Markets - Modern Diplomacy,0.0,0.2333333333333333,-0.5994,0.0,0.262,0.738,Negative
"Buy 2 Vanguard Index Funds to Beat the S&P 500 in the Next Year, According to Wall Street - The Motley Fool","Buy 2 Vanguard Index Funds to Beat the S&P 500 in the Next Year, According to Wall Street - The Motley Fool",0.3,0.45,-0.4404,0.0,0.121,0.879,Negative
‘Not Losing’ Has Different Meanings for Iran and the U.S. - WSJ,‘Not Losing’ Has Different Meanings for Iran and the U.S. - WSJ,0.0,0.6,0.0,0.0,0.0,1.0,Neutral
"2 High-Flying Space Stocks Are Expected to Plunge Up to 56% in 2026, According to Select Wall Street Analysts - The Motley Fool","2 High-Flying Space Stocks Are Expected to Plunge Up to 56% in 2026, According to Select Wall Street Analysts - The Motley Fool",0.25,0.65,-0.4404,0.0,0.116,0.884,Negative
The Back-Channel Diplomacy Behind Trump’s U-Turn on Iran - WSJ,The Back-Channel Diplomacy Behind Trump’s U-Turn on Iran - WSJ,-0.4,0.7,0.0,0.0,0.0,1.0,Neutral
Estée Lauder in Talks to Acquire Spain’s Puig to Create Global Beauty Giant - WSJ,Estée Lauder in Talks to Acquire Spain’s Puig to Create Global Beauty Giant - WSJ,0.0,0.5,0.7096,0.312,0.0,0.688,Positive
Lawmakers Introduce Bipartisan Bill Banning Sports Bets on Prediction Markets - WSJ,Lawmakers Introduce Bipartisan Bill Banning Sports Bets on Prediction Markets - WSJ,0.0,0.0,0.0,0.0,0.0,1.0,Neutral
Opinion | A Sure Bet on a Bad Trend - WSJ,Opinion | A Sure Bet on a Bad Trend - WSJ,-0.09999999999999992,0.7777777777777777,-0.296,0.155,0.236,0.608,Negative
Companies Aren’t Ripping Out Business Software for AI. Here’s What They’re Doing Instead. - WSJ,Companies Aren’t Ripping Out Business Software for AI. Here’s What They’re Doing Instead. - WSJ,0.0,0.0,0.0,0.0,0.0,1.0,Neutral
Opinion | The Profane President Trump - WSJ,Opinion | The Profane President Trump - WSJ,0.0,0.0,0.0,0.0,0.0,1.0,Neutral
See a Minute-by-Minute Breakdown of the Fatal LaGuardia Crash - WSJ,See a Minute-by-Minute Breakdown of the Fatal LaGuardia Crash - WSJ,0.0,0.0,-0.7351,0.0,0.408,0.592,Negative
Wall Street banks just got a rule change worth billions - thestreet.com,Wall Street banks just got a rule change worth billions - thestreet.com,0.3,0.1,0.2263,0.147,0.0,0.853,Positive
Wall Street analyst with 54% success rate cuts Gemini stock target by 20% - thestreet.com,Wall Street analyst with 54% success rate cuts Gemini stock target by 20% - thestreet.com,0.3,0.0,0.3612,0.196,0.116,0.688,Positive
Nasdaq Seeks to Build Crypto Into Wall Street’s Market Plumbing - Bloomberg.com,Nasdaq Seeks to Build Crypto Into Wall Street’s Market Plumbing - Bloomberg.com,0.0,0.0,0.0,0.0,0.0,1.0,Neutral
From the Bluff to Wall Street: Inside LMU’s NYC Career Trek - Loyola Marymount University,From the Bluff to Wall Street: Inside LMU’s NYC Career Trek - Loyola Marymount University,0.0,0.0,0.0,0.0,0.0,1.0,Neutral
Japan Consumer Inflation Rises at Slower Pace - WSJ,Japan Consumer Inflation Rises at Slower Pace - WSJ,0.0,0.0,0.0,0.0,0.0,1.0,Neutral
3 of Wall Street’s Favorite Stocks with Exciting Potential - Yahoo Finance,3 of Wall Street’s Favorite Stocks with Exciting Potential - Yahoo Finance,0.26666666666666666,0.9333333333333332,0.7351,0.383,0.0,0.617,Positive
High oil prices knock down stocks and erase Wall Street’s hopes for a cut to interest rates - AP News,High oil prices knock down stocks and erase Wall Street’s hopes for a cut to interest rates - AP News,0.0022222222222222227,0.4144444444444445,0.5719,0.233,0.084,0.683,Positive
OpenAI's data center pivot underscores Wall Street spending concerns ahead of IPO - CNBC,OpenAI's data center pivot underscores Wall Street spending concerns ahead of IPO - CNBC,-0.1,0.1,0.0,0.0,0.0,1.0,Neutral
How Nvidia Keeps Its Iron Grip on the AI Boom - WSJ,How Nvidia Keeps Its Iron Grip on the AI Boom - WSJ,0.0,0.0,0.0,0.0,0.0,1.0,Neutral
Warren Buffett's Warning to Wall Street Is Echoing Louder Than Ever: 3 Steps Investors Should Take Now - Yahoo Finance,Warren Buffett's Warning to Wall Street Is Echoing Louder Than Ever: 3 Steps Investors Should Take Now - Yahoo Finance,0.5,1.0,-0.34,0.0,0.112,0.888,Negative
"Bitcoin Is Headed to $500,000 According to This Wall Street Analyst and the Reasoning Is Hard to Dismiss - Yahoo Finance","Bitcoin Is Headed to $500,000 According to This Wall Street Analyst and the Reasoning Is Hard to Dismiss - Yahoo Finance",-0.2916666666666667,0.5416666666666666,-0.1027,0.0,0.065,0.935,Negative
Europe Is Quietly Playing a Crucial Role in the Iran War - WSJ,Europe Is Quietly Playing a Crucial Role in the Iran War - WSJ,0.0,0.6666666666666666,-0.4767,0.108,0.234,0.659,Negative
"Wall Street rallies in relief after Trump hints at a possible end to war, even as Iran denies talks - WHEC.com","Wall Street rallies in relief after Trump hints at a possible end to war, even as Iran denies talks - WHEC.com",0.0,1.0,-0.5574,0.112,0.241,0.647,Negative
Wall Street Chips Away at LBO Junk-Debt Pile as Nexstar Wraps Up - Bloomberg.com,Wall Street Chips Away at LBO Junk-Debt Pile as Nexstar Wraps Up - Bloomberg.com,0.0,0.0,0.0,0.0,0.0,1.0,Neutral
"Senators Close In on Deal to End DHS Shutdown, Fund TSA - WSJ","Senators Close In on Deal to End DHS Shutdown, Fund TSA - WSJ",0.0,0.0,0.0,0.0,0.0,1.0,Neutral
Exclusive | Mark Zuckerberg Is Building an AI Agent to Help Him Be CEO - WSJ,Exclusive | Mark Zuckerberg Is Building an AI Agent to Help Him Be CEO - WSJ,0.0,0.0,0.4939,0.231,0.0,0.769,Positive
Wall Street averages end more than 1% higher on Middle East de-escalation hopes - Investing.com,Wall Street averages end more than 1% higher on Middle East de-escalation hopes - Investing.com,0.25,0.3333333333333333,0.4215,0.167,0.0,0.833,Positive
"Nasdaq 100 Leads Wall Street Rebound, ASX and Nikkei in Focus - FOREX.com","Nasdaq 100 Leads Wall Street Rebound, ASX and Nikkei in Focus - FOREX.com",0.0,0.0,0.0,0.0,0.0,1.0,Neutral
Xi Jinping’s Morality Crackdown Has a New Victim: The Global Wine Trade - WSJ,Xi Jinping’s Morality Crackdown Has a New Victim: The Global Wine Trade - WSJ,0.020454545454545447,0.16818181818181818,-0.2732,0.0,0.139,0.861,Negative
Wall Street makes bold Carnival Cruise Line stock move - thestreet.com,Wall Street makes bold Carnival Cruise Line stock move - thestreet.com,0.3333333333333333,0.6666666666666666,0.3818,0.206,0.0,0.794,Positive
Grab To Buy Business Previously Eyed By Uber — Wall Street Cheers Move - Stocktwits,Grab To Buy Business Previously Eyed By Uber — Wall Street Cheers Move - Stocktwits,-0.16666666666666666,0.16666666666666666,0.4767,0.181,0.0,0.819,Positive
"Stocks rally and oil sinks after Trump hints at a possible end to war, even as Iran denies talks - KTVN","Stocks rally and oil sinks after Trump hints at a possible end to war, even as Iran denies talks - KTVN",-0.05,0.5,-0.7717,0.0,0.261,0.739,Negative
Opinion | The Supreme Court and the Street Preacher - WSJ,Opinion | The Supreme Court and the Street Preacher - WSJ,0.0,0.0,0.5574,0.265,0.0,0.735,Positive
Wall Street-Backed Crypto Exchange Takes Aim at Asia FX Market Using Won Stablecoin - Bloomberg.com,Wall Street-Backed Crypto Exchange Takes Aim at Asia FX Market Using Won Stablecoin - Bloomberg.com,0.0,0.0,0.5719,0.209,0.0,0.791,Positive
Wall Street’s Iran “Bear Trap” - Puck,Wall Street’s Iran “Bear Trap” - Puck,0.0,0.0,0.0,0.0,0.0,1.0,Neutral
ICE Agents—Many Unmasked—Deploy to Airports Amid Long TSA Security Lines - WSJ,ICE Agents—Many Unmasked—Deploy to Airports Amid Long TSA Security Lines - WSJ,-0.05,0.4,0.34,0.179,0.0,0.821,Positive
"Trump's Claim U.S., Iran Have Had 'Productive' Talks Sparks Rebound On Wall Street - RTTNews","Trump's Claim U.S., Iran Have Had 'Productive' Talks Sparks Rebound On Wall Street - RTTNews",0.0,0.0,0.0,0.0,0.0,1.0,Neutral
Wall Street Zen Upgrades Weatherford International (NASDAQ:WFRD) to Strong-Buy - MarketBeat,Wall Street Zen Upgrades Weatherford International (NASDAQ:WFRD) to Strong-Buy - MarketBeat,0.0,0.0,0.0,0.0,0.0,1.0,Neutral
Congressman Frost Leads Fight Against Wall Street to Defend Affordable Housing Communities - Congressman Maxwell Frost (.gov),Congressman Frost Leads Fight Against Wall Street to Defend Affordable Housing Communities - Congressman Maxwell Frost (.gov),0.0,0.0,-0.3818,0.0,0.14,0.86,Negative
Wall Street indexes rise after Trump postpones strikes on Iran power plants - The Journal Record,Wall Street indexes rise after Trump postpones strikes on Iran power plants - The Journal Record,0.0,0.0,-0.5574,0.0,0.247,0.753,Negative
Bank of Canada Speech Takes on Heightened Importance Amid Rapid Turn in Rate Expectations - WSJ,Bank of Canada Speech Takes on Heightened Importance Amid Rapid Turn in Rate Expectations - WSJ,0.0,0.0,0.3612,0.143,0.0,0.857,Positive
Wall Street Lunch: Markets Flip After Trump's Iran Pivot - Seeking Alpha,Wall Street Lunch: Markets Flip After Trump's Iran Pivot - Seeking Alpha,0.0,0.0,0.0,0.0,0.0,1.0,Neutral
Stock futures slide after Trump ultimatum to Iran; Wall Street tries to snap 4-week decline - CNBC,Stock futures slide after Trump ultimatum to Iran; Wall Street tries to snap 4-week decline - CNBC,-0.1,0.4,0.0,0.0,0.0,1.0,Neutral
Oil Futures Retreat On Middle East Conflict Seen Easing - WSJ,Oil Futures Retreat On Middle East Conflict Seen Easing - WSJ,0.0,0.0,0.128,0.27,0.163,0.567,Positive
2 AI Stocks Wall Street Says to Sell Before They Drop 55% - The Motley Fool,2 AI Stocks Wall Street Says to Sell Before They Drop 55% - The Motley Fool,0.6,0.9,-0.6124,0.0,0.263,0.737,Negative
The Threats and Bare-Knuckle Tactics of MAGA’s Top Antitrust Fixer - WSJ,The Threats and Bare-Knuckle Tactics of MAGA’s Top Antitrust Fixer - WSJ,0.5,0.5,-0.25,0.123,0.192,0.685,Negative
CME cattle futures higher as Wall Street indexes rally - TradingView,CME cattle futures higher as Wall Street indexes rally - TradingView,0.25,0.5,0.0,0.0,0.0,1.0,Neutral
Wall Street’s Favorite Emerging-Market Bet Falters as War Rages - Bloomberg.com,Wall Street’s Favorite Emerging-Market Bet Falters as War Rages - Bloomberg.com,0.5,1.0,-0.6124,0.167,0.389,0.444,Negative
"Wall Street folds after gold loses 10% in a week, Main Street turns negative as Iran war escalation looms - KITCO","Wall Street folds after gold loses 10% in a week, Main Street turns negative as Iran war escalation looms - KITCO",-0.14444444444444446,0.2777777777777778,-0.8885,0.0,0.404,0.596,Negative
Is It Too Late To Consider Cheniere Energy (LNG) After Its Strong Share Price Run? - simplywall.st,Is It Too Late To Consider Cheniere Energy (LNG) After Its Strong Share Price Run? - simplywall.st,0.06666666666666668,0.6666666666666667,0.765,0.352,0.0,0.648,Positive
"Wall Street rallies after Trump hints at a possible end to war, even as Iran denies talks - AP News","Wall Street rallies after Trump hints at a possible end to war, even as Iran denies talks - AP News",0.0,1.0,-0.7717,0.0,0.271,0.729,Negative
3 of Wall Street’s Favorite Stocks We’re Skeptical Of - Yahoo Finance,3 of Wall Street’s Favorite Stocks We’re Skeptical Of - Yahoo Finance,0.0,0.75,0.1779,0.196,0.15,0.654,Positive
Ocugen’s OCU410 Data And Index Move Test New Investor Interest - simplywall.st,Ocugen’s OCU410 Data And Index Move Test New Investor Interest - simplywall.st,0.13636363636363635,0.45454545454545453,0.4588,0.214,0.0,0.786,Positive
Is V.F (VFC) Offering An Opportunity After Recent Share Price Swings? - simplywall.st,Is V.F (VFC) Offering An Opportunity After Recent Share Price Swings? - simplywall.st,0.0,0.25,0.6124,0.312,0.0,0.688,Positive
Is It Time To Reassess US Foods Holding (USFD) After Recent Share Price Pullback? - simplywall.st,Is It Time To Reassess US Foods Holding (USFD) After Recent Share Price Pullback? - simplywall.st,0.0,0.25,0.296,0.128,0.0,0.872,Positive
